{
    "contract_version": "1.1.0",
    "environment": "sandbox",
    "data_mode": "synthetic_demo",
    "registry_ref": "rg_syn_993b07a9a025bdbf9f0274cd80db7a01",
    "registry_revision": 1,
    "family_count": 17,
    "scenario_count": 34,
    "families": [
        {
            "family_ref": "fm_syn_55ac3c83df942002b8bca40b6cf60a01",
            "service_family": "air_transport",
            "canonical_vertical": "flight",
            "family_subtypes": [
                "scheduled_flight",
                "charter_flight",
                "domestic_flight"
            ],
            "crosswalk": {
                "canonical_taxonomy": "commerce_core_v1",
                "mapping_kind": "orchestration_bucket_only",
                "operation_routing": "dedicated_service_family_adapter",
                "orchestration_adapter": "air_transport_orchestration_adapter_v1",
                "equivalence_claimed": false,
                "subtype_preserved": true
            },
            "lifecycle": {
                "search": "required",
                "revalidate": "required",
                "hold_reserve": "conditional",
                "confirm": "required",
                "fulfill": "required",
                "change": "required",
                "cancel": "required",
                "refund": "conditional",
                "incident": "required",
                "reconciliation": "required",
                "settlement": "required",
                "post_service_evidence": "required"
            },
            "critical_facts": [
                "origin_destination_airport_codes",
                "operating_marketing_carrier_roles",
                "segment_and_traveler_status",
                "fare_brand_and_baggage_rules",
                "ticket_coupon_and_emd_status",
                "special_service_request_status",
                "connection_and_minimum_time"
            ],
            "critical_deadlines": [
                "offer_expiry_utc",
                "ticketing_deadline_utc",
                "check_in_cutoff_utc",
                "change_cancel_deadline_utc"
            ],
            "required_handoffs": [
                "airline_order_servicing_handoff",
                "ticketing_consolidator_handoff",
                "airport_disruption_desk_handoff"
            ],
            "israel_local": {
                "applicable": true,
                "scope": "domestic_and_outbound",
                "required_fact_codes": [
                    "israel_airport_terminal",
                    "domestic_airport_pair",
                    "departure_security_buffer",
                    "holiday_operating_schedule"
                ]
            },
            "map": {
                "overview_zoom": 2,
                "decision_zoom": 6,
                "operational_zoom": 14,
                "cluster_until_zoom": 5,
                "geometry": "route",
                "resolution_path": [
                    "overview",
                    "decision",
                    "operational"
                ],
                "detail_surface": "attached_non_occluding_context_panel",
                "operational_anchor_codes": [
                    "route_origin_anchor",
                    "route_destination_anchor",
                    "route_connection_anchor"
                ],
                "selection_to_plan_required": true,
                "viewport_padding_required": true,
                "rtl_mobile_safe_area_required": true,
                "source_freshness_required": true,
                "reduced_motion_alternative_required": true
            }
        },
        {
            "family_ref": "fm_syn_b5af036e08ddc544b9b7bc79499bfc79",
            "service_family": "lodging",
            "canonical_vertical": "accommodation",
            "family_subtypes": [
                "city_business_hotel",
                "resort_hotel",
                "boutique_hotel",
                "vacation_apartment_short_term_rental",
                "villa",
                "hostel",
                "rural_bnb_zimmer",
                "kibbutz_holiday_village_guest_accommodation",
                "campground_glamping"
            ],
            "crosswalk": {
                "canonical_taxonomy": "commerce_core_v1",
                "mapping_kind": "orchestration_bucket_only",
                "operation_routing": "dedicated_service_family_adapter",
                "orchestration_adapter": "lodging_orchestration_adapter_v1",
                "equivalence_claimed": false,
                "subtype_preserved": true
            },
            "lifecycle": {
                "search": "required",
                "revalidate": "required",
                "hold_reserve": "conditional",
                "confirm": "required",
                "fulfill": "required",
                "change": "required",
                "cancel": "required",
                "refund": "conditional",
                "incident": "required",
                "reconciliation": "required",
                "settlement": "required",
                "post_service_evidence": "required"
            },
            "critical_facts": [
                "property_and_unit_geography",
                "occupancy_and_child_age_rules",
                "room_allocation_and_bedding",
                "check_in_and_key_handoff",
                "meal_board_and_kosher_scope",
                "accessibility_route_and_unit",
                "tax_deposit_and_damage_terms",
                "city_business_arrival_and_workday_fit",
                "resort_facility_schedule_and_fee_scope",
                "boutique_unit_variance_and_staffing",
                "short_term_rental_host_key_and_registration_state",
                "villa_occupancy_pool_and_whole_property_scope",
                "hostel_bed_dorm_locker_and_age_rules",
                "rural_zimmer_access_shelter_and_host_handoff",
                "kibbutz_guest_unit_gate_dining_and_holiday_access",
                "campground_pitch_utility_weather_and_fire_rules"
            ],
            "critical_deadlines": [
                "cancellation_deadline_utc",
                "payment_schedule_deadline_utc",
                "arrival_notice_deadline_utc",
                "check_in_cutoff_local",
                "business_hotel_late_arrival_deadline_local",
                "resort_facility_reservation_deadline_local",
                "boutique_staffed_check_in_deadline_local",
                "short_term_rental_key_release_deadline_local",
                "villa_guest_manifest_deadline_utc",
                "hostel_late_arrival_deadline_local",
                "rural_zimmer_host_reconfirmation_deadline_local",
                "kibbutz_gate_access_deadline_local",
                "campground_arrival_weather_decision_deadline_local"
            ],
            "required_handoffs": [
                "property_reservations_handoff",
                "property_after_hours_handoff",
                "local_lodging_recovery_handoff",
                "city_hotel_front_desk_handoff",
                "resort_guest_services_handoff",
                "boutique_on_call_host_handoff",
                "short_term_rental_host_and_platform_handoff",
                "villa_property_manager_handoff",
                "hostel_reception_handoff",
                "rural_zimmer_host_handoff",
                "kibbutz_guest_house_handoff",
                "campground_operator_or_ranger_handoff"
            ],
            "israel_local": {
                "applicable": true,
                "scope": "domestic_and_outbound",
                "required_fact_codes": [
                    "local_tax_treatment",
                    "local_key_handoff",
                    "shabbat_holiday_operation",
                    "kosher_evidence_scope"
                ]
            },
            "map": {
                "overview_zoom": 4,
                "decision_zoom": 11,
                "operational_zoom": 18,
                "cluster_until_zoom": 10,
                "geometry": "point",
                "resolution_path": [
                    "overview",
                    "decision",
                    "operational"
                ],
                "detail_surface": "attached_non_occluding_context_panel",
                "operational_anchor_codes": [
                    "location_centroid_anchor",
                    "public_entrance_anchor",
                    "arrival_handoff_anchor",
                    "city_hotel_public_transport_anchor",
                    "resort_reception_and_facility_anchor",
                    "boutique_hotel_entrance_anchor",
                    "short_term_rental_key_handoff_anchor",
                    "villa_gate_and_safety_anchor",
                    "hostel_reception_and_bed_anchor",
                    "rural_zimmer_access_and_shelter_anchor",
                    "kibbutz_gate_and_guest_unit_anchor",
                    "campground_pitch_and_emergency_anchor"
                ],
                "selection_to_plan_required": true,
                "viewport_padding_required": true,
                "rtl_mobile_safe_area_required": true,
                "source_freshness_required": true,
                "reduced_motion_alternative_required": true
            }
        },
        {
            "family_ref": "fm_syn_8356807595fa0267a74937b782422d4d",
            "service_family": "dynamic_package",
            "canonical_vertical": "package",
            "family_subtypes": [
                "flight_lodging_package",
                "lodging_activity_package",
                "custom_multi_component_package"
            ],
            "crosswalk": {
                "canonical_taxonomy": "commerce_core_v1",
                "mapping_kind": "orchestration_bucket_only",
                "operation_routing": "dedicated_service_family_adapter",